_id,category,content,cleaned_tokens_ner,cleaned_tokens_stopwords,tokens
6477c3c1540bc5d16fa5eb0f,Sport,Robert Glină a anunat că se retrage din înotul de performanță printro postare pe Facebook În vârstă de de  de ani Robert Glință a fost campion european în  la  metri spate și campion mondial de juniori în  la aceeași probăA venit momentul să fac un pas înapoi de la înotul competiționalCu suișuri și coborâșuri acest sport ma învățat atât de multe și ma făcut cu adevărat să devin ființa umană mai evoluată care sunt astăziFie că este vorba de durere sau glorie eșec sau succes suferință sau fericire nivelul de responsabilitate disciplină dăruire ambiție prin munca grea de a atinge un obiectiv și de a depăși obstacolele au crescut rădăcini adânci în mine care vor rămâne pentru totdeauna cu mineNimic nu ar fi fost posibil fără oamenii cu care am lucrat Fiecare dintre ei jucând un rol uriaș și lăsând o amprentă importantă în cariera și viața mea Pentru ei nu există suficiente cuvinte prin care să exprim suficient recunotinaToate amintirile minunate și prietenii dragi pe care mi lea adus acest drum legăturile sufletești care depășesc viața de competiție mă fac să simt că am câștigat mult mai mult decât niște medalii și trofeeTuturor prietenilor și fanilor vreau să vă mulțumesc pentru că vați arătat mereu sprijinul și pentru că ați crezut în mine indiferent de situațieResursele sunt epuizate și este timpul să am grijă de propria mea sănătate fizică mentală emoțională și spirituală pentru că până la urmă sunt doar o ființă umanăA venit momentul să fac un pas înapoi de la înotulcompetițional a scris Robert Glință pe Facebook Editor   DC,"[a, anunat, că, se, retrage, din, înotul, de, performanță, printro, postare, pe, Facebook, În, vârstă, de, de, de, ani, Robert, Glință, a, fost, campion, european, în, la, metri, spate, și, campion, mondial, de, juniori, în, la, aceeași, probăA, venit, momentul, să, fac, un, pas, înapoi, de, la, înotul, competiționalCu, suișuri, și, coborâșuri, acest, sport, ma, învățat, atât, de, multe, și, ma, făcut, cu, adevărat, să, devin, ființa, umană, mai, evoluată, care, sunt, astăziFie, că, este, vorba, de, durere, sau, glorie, eșec, sau, succes, suferință, sau, fericire, nivelul, de, responsabilitate, disciplină, dăruire, ambiție, prin, munca, grea, de, a, atinge, un, obiectiv, și, de, a, depăși, obstacolele, au, crescut, rădăcini, adânci, în, mine, care, vor, rămâne, pentru, totdeauna, cu, mineNimic, nu, ar, fi, fost, posibil, fără, cu, care, am, lucrat, Fiecare, dintre, ei, jucând, un, rol, uriaș, și, lăsând, o, amprentă, importantă, în, cariera, și, viața, mea, Pentru, nu, există, suficiente, cuvinte, prin, care, să, exprim, suficient, recunotinaToate, amintirile, minunate, și, prietenii, dragi, pe, care, mi, lea, adus, acest, drum, legăturile, sufletești, care, depășesc, viața, de, competiție, mă, fac, să, simt, că, am, câștigat, mult, mai, mult, decât, niște, medalii, și, trofeeTuturor, și, vreau, să, vă, mulțumesc, pentru, că, vați, arătat, mereu, sprijinul, și, pentru, că, ați, crezut, în, mine, indiferent, de, situațieResursele, sunt, epuizate, și, este, timpul, să, am, grijă, de, propria, mea, sănătate, fizică, mentală, emoțională, și, spirituală, pentru, că, până, la, urmă, sunt, doar, o, ființă, umanăA, venit, momentul, să, fac, un, pas, înapoi, de, la, înotulcompetițional, a, scris, pe, Facebook, Editor, DC]","[anunat, retrage, înotul, performanță, printro, postare, Facebook, vârstă, ani, Robert, Glință, campion, european, metri, campion, mondial, juniori, probăA, venit, momentul, fac, pas, înapoi, înotul, competiționalCu, suișuri, coborâșuri, sport, învățat, atât, făcut, adevărat, devin, ființa, umană, evoluată, astăziFie, vorba, durere, glorie, eșec, succes, suferință, fericire, nivelul, responsabilitate, disciplină, dăruire, ambiție, munca, grea, atinge, obiectiv, depăși, obstacolele, crescut, rădăcini, adânci, rămâne, totdeauna, mineNimic, posibil, lucrat, jucând, rol, uriaș, lăsând, amprentă, importantă, cariera, viața, există, suficiente, cuvinte, exprim, suficient, recunotinaToate, amintirile, minunate, prietenii, dragi, lea, adus, drum, legăturile, sufletești, depășesc, viața, competiție, fac, simt, câștigat, decât, medalii, trofeeTuturor, vreau, vați, arătat, sprijinul, crezut, indiferent, situațieResursele, epuizate, timpul, grijă, propria, sănătate, fizică, mentală, emoțională, spirituală, urmă, ființă, umanăA, venit, momentul, fac, pas, înapoi, înotulcompetițional, scris, Facebook, Editor, DC]","[anuna, retrage, înot, performanță, printro, postare, Facebook, vârst, an, Robert, Glință, campion, european, metru, campion, mondial, junior, probăA, veni, moment, face, pas, înapoi, înot, competiționalCu, suiș, coborâșu, sport, învățat, atât, face, adevărat, deveni, ființă, uman, evolua, astăziFie, vorbă, durere, glorie, eșec, succes, suferință, fericire, nivel, responsabilitat, disciplină, dăruire, ambiție, muncă, gre, atinge, obiectiv, depăși, obstacol, crescut, rădăcină, adânc, rămâne, totdeauna, mineNimic, posibil, lucra, juca, rol, uriaș, lăsa, amprentă, important, carieră, viață, exista, suficient, cuvânt, exprim, suficient, recunotinaToate, amintire, minunat, prieten, drag, lea, aduce, drum, legătură, sufletesc, depăși, viață, competiție, face, simți, câștiga, decât, medalii, trofeeTuturor, vrea, va, arăta, sprijin, crede, indiferent, situațieResurs, epuizat, timp, grijă, propriu, sănătate, fizic, mental, emoțional, spiritual, urma, ființă, umanăA, veni, moment, face, pas, înapoi, înotulcompetițional, scris, Facebook, Editor, DC]"
6477c420540bc5d16fa5f351,Sport,Regele Arabiei Sauditei a decretat sărbătoare națională pentru miercuri Toți angajații elevii și studenți sunt liberi ca să se bucure după ce echipa națională de fotbal a învins Argentina la Cupa Mondială  din Qatar A fost  la  pentru saudiți în fața argentinienilor și fanii din regatul arab au explodat de bucurie au cântat și au dansatSelecționata Arabiei Saudite este autoarea unuia dintre cele mai mari șocuri din istoria Cupei Mondiale Echipa era considerată a doua cea mai slabă dintre cele prezente la turneul final din Qatar după Ghana Editor   DC,"[a, decretat, sărbătoare, națională, pentru, Toți, angajații, și, sunt, liberi, ca, să, se, bucure, după, ce, echipa, națională, de, fotbal, a, învins, Argentina, la, Cupa, Mondială, din, Qatar, A, fost, la, pentru, saudiți, în, fața, și, din, regatul, arab, au, explodat, de, bucurie, au, cântat, și, au, dansatSelecționata, Arabiei, Saudite, este, autoarea, unuia, dintre, cele, mai, mari, șocuri, din, istoria, Cupei, Mondiale, Echipa, era, considerată, cea, mai, slabă, dintre, cele, prezente, la, turneul, final, din, Qatar, după, DC]","[decretat, sărbătoare, națională, angajații, liberi, bucure, echipa, națională, fotbal, învins, Argentina, Cupa, Mondială, Qatar, saudiți, fața, regatul, arab, explodat, bucurie, cântat, dansatSelecționata, Arabiei, Saudite, autoarea, mari, șocuri, istoria, Cupei, Mondiale, Echipa, considerată, slabă, prezente, turneul, final, Qatar, DC]","[decreta, sărbător, național, angajaț, liber, bucur, echipă, național, fotbal, învins, Argentina, cupă, mondial, Qatar, saudi, față, regat, arab, explodat, bucurie, cântat, dansatSelecționată, arabie, saudite, autoare, mare, șoc, istorie, cupă, mondial, echipă, considerat, slab, prezent, turneu, final, Qatar, DC]"
6477c445540bc5d16fa5f6c0,Sport,În România sportul de performanță este doar pentru copiii susținuți financiar de familie sau de sponsori Cine nu are bani rămâne cu visul Antrenorii povestesc cum cel puțin jumătate dintre copiii care se apucă de sport renunță repede din cauza lipsurilor Parlamentarii își închipuie că dacă fiecare copil legitimat la un club sportiv va primi din ianuarie  de lei pe lună banii îi vor ajunge pentru nutriție transport și echipamentSunt frânturi de vise mari Visuri de copii careși doresc să ajungă ca Messi Halep Popovici și ceilalți idoli descoperiți la televizor Teoretic șanse au toți Practic performanța depinde de bani bani mulți care lasă gol adânc în bugetul unei familii cu venituri mediiIlinca de exemplu este vicecampioană națională la lupte Are  ani trăiește în comuna Frăsinet din Călărași și este legitimată la un club din Pantelimon lângă București Ca să participe la antrenamente familia cheltuie lunar o mică avere doar pe transportReporter Digi Cât vă costă transportul de aici din Călărași Frăsinet până la BucureștiFlorin Manta părinte În jur de  pe săptămână În jur de o mie de lei pe lunăIlinca e singurul copil din comuna Frăsinet care practică sport la nivel înalt Primăria a înființat un club de fotbal pentru elevii comunei pentru mișcare și sănătate Majoritatea provin din familii care nuși permit săi susțină pentru performanțăFlorina Daniela Anghel directoarea Școlii Generale Frăsinet Avem  de elevi care sunt legitimați la echipa de fotbal Unirea Frăsinet Dar mai departe nu știu dacă au posibilitatea să meargă Chiar am avut un caz o elevă care acum este clasa a șasea a făcut canotaj și a renunțat la acest sport din lipsa susținerii financiare Părinții nu șiau permis să o susțină în continuare să practice acest sportPovestea elevei căreia sărăcia ia frânt visul de campioană la canoe neo spune pe scurt chiar mama saNicoleta Ion părinte Eu cu  de lei pensia mea de handicap că nu am o mână nam putut so întrețin Am încercat din răsputeri dar nam putut so întrețin  Le trebuiau foarte multe echipamente Și pentru chestia asta nam mai putut so ținNui singurul copil cu visul spulberat de bani Din cauza sărăciei sportul pierde o sumedenie de talente mai ales din mediul ruralFelix Vernescu antrenor Lehliu Gară Jumătate renunță pentru că nu au sprijinul familiei nu au posibilitatea de ași întreține activitatea sportivă pe care o fac Sportul de performanță este costisitor pentru că necesită echipament dacă sunt din alte localități și nu sunt din Lehliu Gară trebuie să facă naveta pe mijloace de transport în comun abonamentele fiind decontate doar la liceu și la școală nu sunt decontate și pentru sport Și copiii se descurcă care cum pot Unii vin cu ocazieSituația sar putea schimba Parlamentul a votat ca din ianuarie încolo fiecare copil care practică sport de performanță să primească lunar câte  de lei sub formă de voucher Pentru transport al competiții nutriție sau echipament Legea așteaptă promulgareaIlinca Manta Păi mă ajută sămi cumpăr și haine și ce am nevoieFlorin Manta Echipament tată Că ăsta Cu transportul cu asteao rezolvăm noi E bun ăsta Mai îți iei o pereche de pantaloni mai o bluză mai un tricou maiPoți săi strângi șiți cumperi o pereche de ghete Editor   AC,"[În, România, sportul, de, performanță, este, doar, pentru, susținuți, financiar, de, familie, sau, de, nu, are, bani, rămâne, cu, visul, povestesc, cum, cel, puțin, jumătate, dintre, care, se, apucă, de, sport, renunță, repede, din, cauza, lipsurilor, Parlamentarii, își, închipuie, că, dacă, fiecare, legitimat, la, un, club, sportiv, va, primi, din, de, lei, pe, lună, banii, îi, vor, ajunge, pentru, nutriție, transport, și, echipamentSunt, frânturi, de, vise, mari, Visuri, de, careși, doresc, să, ajungă, ca, Messi, Halep, Popovici, și, ceilalți, idoli, descoperiți, la, televizor, Teoretic, șanse, au, toți, Practic, performanța, depinde, de, bani, bani, mulți, care, lasă, gol, adânc, în, bugetul, unei, familii, cu, venituri, mediiIlinca, de, exemplu, este, vicecampioană, națională, la, lupte, Are, ani, trăiește, în, comuna, Frăsinet, din, Călărași, și, este, legitimată, la, un, club, din, Pantelimon, lângă, București, Ca, să, participe, la, antrenamente, familia, cheltuie, lunar, o, mică, avere, doar, pe, transportReporter, Digi, Cât, vă, costă, transportul, de, aici, din, Călărași, Frăsinet, până, la, BucureștiFlorin, Manta, părinte, În, jur, de, pe, săptămână, În, jur, de, pe, lunăIlinca, e, singurul, din, comuna, Frăsinet, care, practică, sport, la, nivel, înalt, Primăria, a, înființat, un, club, de, fotbal, pentru, comunei, pentru, mișcare, și, sănătate, Majoritatea, provin, din, familii, care, nuși, permit, săi, susțină, pentru, performanțăFlorina, de, care, sunt, legitimați, la, echipa, de, fotbal, Unirea, Frăsinet, Dar, mai, departe, nu, știu, dacă, au, posibilitatea, să, meargă, Chiar, am, avut, un, caz, o, care, acum, este, clasa, a, făcut, canotaj, și, a, renunțat, la, acest, sport, din, lipsa, susținerii, financiare, nu, șiau, permis, să, o, susțină, în, continuare, să, practice, acest, sportPovestea, elevei, căreia, sărăcia, ia, frânt, visul, de, campioană, la, canoe, neo, spune, pe, scurt, chiar, saNicoleta, Ion, părinte, Eu, cu, de, lei, pensia, mea, de, handicap, că, nu, am, o, mână, nam, putut, so, întrețin, Am, încercat, din, răsputeri, dar, nam, putut, so, întrețin, Le, trebuiau, foarte, multe, echipamente, Și, pentru, chestia, asta, nam, mai, putut, so, ținNui, singurul, cu, visul, spulberat, de, bani, Din, cauza, sărăciei, sportul, pierde, o, sumedenie, de, talente, mai, ales, din, mediul, ruralFelix, renunță, pentru, că, nu, au, sprijinul, familiei, nu, au, posibilitatea, de, ași, întreține, activitatea, sportivă, pe, care, o, fac, Sportul, de, performanță, este, costisitor, pentru, că, necesită, echipament, dacă, sunt, din, alte, localități, și, nu, sunt, din, trebuie, să, facă, naveta, pe, mijloace, de, transport, în, comun, abonamentele, fiind, decontate, doar, la, liceu, și, la, școală, nu, sunt, decontate, și, pentru, sport, Și, copiii, se, descurcă, care, cum, pot, Unii, vin, cu, ocazieSituația, sar, putea, schimba, Parlamentul, a, votat, ca, din, încolo, fiecare, care, practică, sport, de, performanță, să, primească, lunar, câte, sub, formă, de, voucher, Pentru, transport, al, competiții, nutriție, sau, echipament, Legea, așteaptă, promulgareaIlinca, Manta, Păi, mă, ajută, sămi, cumpăr, și, haine, și, ce, am, nevoieFlorin, Manta, Echipament, tată, Că, ăsta, Cu, transportul, cu, asteao, rezolvăm, noi, E, bun, ăsta, Mai, îți, iei, o, de, pantaloni, mai, o, bluză, mai, un, tricou, maiPoți, săi, strângi, șiți, cumperi, o, de, ghete, Editor, AC]","[România, sportul, performanță, susținuți, financiar, familie, bani, rămâne, visul, povestesc, puțin, jumătate, apucă, sport, renunță, repede, cauza, lipsurilor, Parlamentarii, își, închipuie, legitimat, club, sportiv, primi, lei, lună, banii, ajunge, nutriție, transport, echipamentSunt, frânturi, vise, mari, Visuri, careși, doresc, ajungă, Messi, Halep, Popovici, ceilalți, idoli, descoperiți, televizor, Teoretic, șanse, Practic, performanța, depinde, bani, bani, lasă, gol, adânc, bugetul, familii, venituri, mediiIlinca, exemplu, vicecampioană, națională, lupte, ani, trăiește, comuna, Frăsinet, Călărași, legitimată, club, Pantelimon, București, participe, antrenamente, familia, cheltuie, lunar, mică, avere, transportReporter, Digi, costă, transportul, Călărași, Frăsinet, BucureștiFlorin, Manta, părinte, jur, săptămână, jur, lunăIlinca, singurul, comuna, Frăsinet, practică, sport, nivel, înalt, Primăria, înființat, club, fotbal, comunei, mișcare, sănătate, Majoritatea, provin, familii, nuși, permit, susțină, performanțăFlorina, legitimați, echipa, fotbal, Unirea, Frăsinet, posibilitatea, meargă, caz, clasa, făcut, canotaj, renunțat, sport, lipsa, susținerii, financiare, șiau, permis, susțină, continuare, practice, sportPovestea, elevei, căreia, sărăcia, frânt, visul, campioană, canoe, neo, spune, scurt, saNicoleta, Ion, părinte, lei, pensia, handicap, mână, nam, putut, so, întrețin, încercat, răsputeri, nam, putut, so, întrețin, trebuiau, echipamente, chestia, nam, putut, so, ținNui, singurul, visul, spulberat, bani, cauza, sărăciei, sportul, pierde, sumedenie, talente, ales, mediul, ruralFelix, renunță, sprijinul, familiei, posibilitatea, ași, întreține, activitatea, sportivă, fac, Sportul, performanță, costisitor, necesită, echipament, localități, trebuie, facă, naveta, mijloace, transport, comun, abonamentele, fiind, decontate, liceu, școală, decontate, sport, copiii, descurcă, vin, ocazieSituația, sar, putea, schimba, Parlamentul, votat, încolo, practică, sport, performanță, primească, lunar, formă, voucher, transport, competiții, nutriție, echipament, Legea, așteaptă, promulgareaIlinca, Manta, ajută, sămi, cumpăr, haine, nevoieFlorin, Manta, Echipament, tată, transportul, asteao, rezolvăm, bun, iei, pantaloni, bluză, tricou, maiPoți, strângi, șiți, cumperi, ghete, Editor, AC]","[România, sport, performanță, susținut, financiar, familie, ban, rămâne, vis, povestesc, puțin, jumătate, apuca, sport, renunța, repede, cauză, lips, Parlamentarii, sine, închipui, legitimat, club, sportiv, primi, leu, lună, ban, ajunge, nutriție, transport, echipamentSunte, frânt, vis, mare, Vis, careși, dori, ajungă, Messi, Halep, Popovici, celălalt, idol, descoperit, televizor, teoretic, șansă, practic, performanță, depinde, ban, ban, lăsa, gol, adânc, buget, familie, venit, mediiIlinca, exemplu, vicecampioană, național, luptă, an, trăi, comună, Frăsinet, călărași, legitima, club, Pantelimon, București, participă, antrenament, familie, cheltui, lunar, mic, avere, transportReporter, digi, costa, transport, călărași, Frăsinet, BucureștiFlorin, Manta, părinte, jur, săptămână, jur, lunăIlinca, singur, comună, Frăsinet, practica, sport, nivel, înalt, primărie, înființa, club, fotbal, comună, mișcare, sănătate, majoritate, proveni, familie, nus, permite, susțin, performanțăFlorina, legitima, echipă, fotbal, unire, Frăsinet, posibilitate, mearg, caz, clasă, face, canotaj, renunțat, sport, lipsă, susținere, financiar, șia, permite, susțin, continuare, practic, sportPovestea, elevă, care, sărăcie, frânt, vis, campioană, canoe, neo, spune, scurt, saNicoleta, Ion, părinte, leu, pensie, handicap, mână, nam, putea, so, întreține, încerca, răsputer, nam, putea, so, întreține, trebui, echipament, chestie, nam, putea, so, ținNui, singur, vis, spulbera, ban, cauză, sărăcie, sport, pierde, sumedenie, talent, ales, mediu, ruralFelix, renunța, sprijin, familie, posibilitate, as, întreține, activitate, sportiv, face, sport, performanță, costisitor, necesita, echipament, localitate, trebui, fac, naveta, mijloc, transport, comun, abonament, fi, deconta, liceu, școal, decontate, sport, copil, descurca, veni, ocazieSituație, sar, putea, schimba, parlament, vota, încolo, practica, sport, performanță, primesc, lunar, formă, voucher, transport, competiție, nutriție, echipament, lege, aștepta, promulgareaIlinca, Manta, ajuta, sămi, cumpăre, haină, nevoieFlorin, Manta, Echipament, ta, transport, asteao, rezolvăm, bun, ie, pantalon, bluza, tricou, maiPoți, strânge, șit, cumpere, gheată, Editor, AC]"
6477c44c540bc5d16fa5f79c,Sport,Ministrul sportului Eduard Novak consideră că sportul românesc a înregistrat un regres semnificativ i că a fost nevoie de elaborarea Strategiei Naionale pentru Sport ca să se ofere stabilitate acestui domeniu El a prezentat joi la ClujNapoca strategia pentru sport care a fost elaborată de Ministerul Sportului în colaborare cu specialiti ai Universităii BabeBolyai UBB din ClujNapocaDocumentul strategic a fost elaborat din mai multe cauze Cu toii am observat că sportul românesc are un regres semnificativ Dacă la Jocurile Olimpice din anul  am obinut  de medalii la cele din  am obinut doar  fiind un regres de  Acest lucru are nite cauze i am dorit ca prin această strategie naională să încercăm să dăm o stabilitate sportului românesc pentru viitor a spus Eduard NovakÎn ceea ce privete sportul în coală avem două ore de sport săptămână iar în programa colară sunt doar trei sporturi  atletism gimnastică i jocuri Copiii nu mai sunt atrai de sport în coală iar în loc să îi împrietenim cu sportul îi îndepărtăm În Europa sunt  sporturi în coli Sportul în coală nu este dezvoltat copiii nu fac micare i sunt predispui la obezitate Dorim să intervenim să ajungem ca în  ani copiii să aibă  ore de educaie fizică plus două activităi fizice extracolare a mai spus Eduard NovakNoua strategie se bazează pe trei piloni  sport de masă sport în coală sport de performană  care toate se leagă i trebuie să fie întrun pachet complet relatează Agerpres  Editor   Luana Pavaluca,"[consideră, că, sportul, românesc, a, înregistrat, un, regres, semnificativ, i, că, a, fost, nevoie, de, elaborarea, Strategiei, Naionale, pentru, Sport, ca, să, se, ofere, stabilitate, acestui, domeniu, El, a, prezentat, la, ClujNapoca, strategia, pentru, sport, care, a, fost, elaborată, de, Ministerul, Sportului, în, colaborare, cu, specialiti, ai, Universităii, BabeBolyai, UBB, din, ClujNapocaDocumentul, strategic, a, fost, elaborat, din, mai, multe, cauze, Cu, toii, am, observat, că, sportul, românesc, are, un, regres, semnificativ, Dacă, la, Jocurile, Olimpice, din, anul, am, obinut, de, medalii, la, cele, din, am, obinut, doar, fiind, un, regres, de, Acest, lucru, are, nite, i, am, dorit, ca, prin, această, strategie, naională, să, încercăm, să, dăm, o, stabilitate, sportului, românesc, pentru, viitor, a, spus, Eduard, NovakÎn, ceea, ce, privete, sportul, în, coală, avem, iar, în, programa, colară, sunt, doar, sporturi, atletism, gimnastică, i, jocuri, Copiii, nu, mai, sunt, atrai, de, sport, în, coală, iar, în, loc, să, îi, împrietenim, cu, sportul, îi, îndepărtăm, În, Europa, sunt, sporturi, în, coli, Sportul, în, coală, nu, este, dezvoltat, nu, fac, micare, i, sunt, predispui, la, obezitate, Dorim, să, intervenim, să, ajungem, ca, în, ani, copiii, să, aibă, ore, de, educaie, fizică, plus, activităi, fizice, extracolare, a, mai, spus, Eduard, NovakNoua, strategie, se, bazează, pe, piloni, sport, de, masă, sport, în, coală, sport, de, performană, care, toate, se, leagă, i, trebuie, să, fie, întrun, pachet, complet, relatează, Agerpres, Editor]","[consideră, sportul, românesc, înregistrat, regres, semnificativ, elaborarea, Strategiei, Naionale, Sport, ofere, stabilitate, domeniu, prezentat, ClujNapoca, strategia, sport, elaborată, Ministerul, Sportului, colaborare, specialiti, Universităii, BabeBolyai, UBB, ClujNapocaDocumentul, strategic, elaborat, cauze, toii, observat, sportul, românesc, regres, semnificativ, Jocurile, Olimpice, anul, obinut, medalii, obinut, fiind, regres, lucru, nite, dorit, strategie, naională, încercăm, dăm, stabilitate, sportului, românesc, viitor, spus, Eduard, NovakÎn, privete, sportul, coală, programa, colară, sporturi, atletism, gimnastică, jocuri, Copiii, atrai, sport, coală, loc, împrietenim, sportul, îndepărtăm, Europa, sporturi, coli, Sportul, coală, dezvoltat, fac, micare, predispui, obezitate, Dorim, intervenim, ajungem, ani, copiii, ore, educaie, fizică, activităi, fizice, extracolare, spus, Eduard, NovakNoua, strategie, bazează, piloni, sport, masă, sport, coală, sport, performană, leagă, trebuie, întrun, pachet, complet, relatează, Agerpres, Editor]","[considera, sport, românesc, înregistrat, regres, semnificativ, elaborare, Strategia, Naionale, Sport, oferi, stabilitate, domeniu, prezenta, ClujNapoca, strategie, sport, elaborat, minister, sport, colaborare, specialiti, universităii, BabeBolyai, UBB, clujNapocaDocument, strategic, elaborat, cauză, toaie, observa, sport, românesc, regres, semnificativ, joc, olimpic, an, obine, medal, obine, fi, regres, lucru, nit, dorit, strategie, naional, încercăm, da, stabilitate, sport, românesc, viitor, spune, Eduard, NovakÎn, privată, sport, coal, programă, colar, sport, atletism, gimnastica, joc, copil, atrai, sport, coal, loc, împrietenim, sport, îndepărta, Europa, sport, coli, sport, coal, dezvoltat, face, micare, predispu, obezitat, Dorim, interveni, ajunge, an, copil, oră, educai, fizic, activitău, fizic, extracolare, spune, Eduard, NovakNoua, strategie, baza, pilon, sport, masă, sport, coal, sport, performan, lega, trebui, întrun, pachet, complet, relata, Agerpres, Editor]"
