_id,category,content,cleaned_tokens_ner,cleaned_tokens_stopwords,tokens
6477c2fd540bc5d16fa5d5f2,Vacanțe,Federaia Patronatelor din Turismul Românesc FPTR lansează luni o nouă ediie a programului Litoralul pentru toi cu preuri cu până la  mai mici faă de cele din vârful sezonuluiContinuăm acest program de succes pe care românii îl ateaptă în fiecare an Este perioada în care preurile pe litoral sunt cu până la  mai mici decât în vârf de sezon iar pentru muli turiti reprezintă poate singura variantă prin care pot merge în vacană la mare câteva zile Cele mai multe hoteluri vor fi deschise începând cu sfâritul lunii mai dar turitii pot face deja rezervări de sejururi pentru acest program a declarat Drago Răducan preedintele FPTR citat de AgerpresAstfel potrivit tarifelor de pe siteurile operatorilor de turism până pe data de  iunie românii pot petrece un sejur la mare cu tarife pornind de la  de lei pe noapte de persoană pre ce include doar cazare fără mic dejun la un hotel de  stele din staiunea Venus În staiunea Mamaia preurile pornesc de la  leinoaptepersoană în camera dublă ofertă valabilă la un hotel de  stele iar în staiunile din sudul litoralului tarifele încep de la  leinoaptepersoană în camera dublă la un hotel de  stele Pentru cei care vor pachete all inclusive acestea sunt disponibile la preuri ce pornesc de la  de leinoaptepersoană în camera dublă la o unitate de  stele din staiunea JupiterLe recomandăm turitilor care vor să profite de aceste oferte să facă deja rezervări pentru că locurile sunt limitate i se epuizează repede Rezervările se pot face direct la hotel dar i prin intermediul ageniilor de turism La fel ca la ediiile anterioare pachetele turistice pot fi achitate i cu vouchere de vacană a mai spus preedintele FPTRPotrivit FPTR în program sau înscris până vineri  de unităi de cazare din toate staiunile de pe litoralul românesc care pun la dispoziia turitilor cumulat un număr de aproximativ  de locuri de cazare pe noapte iar până la începerea programului ateaptă să se înscrie aproximativ  de hoteluri care vor pune la dispoziia turitilor aproximativ  de locuri de cazare pe noapteProgramul Litoralul pentru Toi se află la ediia cu numărul  i este singurul program social din România susinut integral de mediul de afaceri respectiv de patronatele hoteliere autohtoneFederaia Patronatelor din Turismul Românesc este singura federaie patronală cu reprezentativitate legală la nivel de sector de activitate turism hoteluri restaurante având în componenă societăi comerciale din turism care asigură venituri salariale pentru  de angajai gestionând întro pondere covâritoare capital românesc Editor   AP,"[din, Turismul, Românesc, FPTR, lansează, o, nouă, ediie, a, programului, Litoralul, pentru, toi, cu, preuri, cu, până, la, mai, mici, faă, de, cele, din, vârful, sezonuluiContinuăm, acest, program, de, succes, pe, care, românii, îl, ateaptă, în, Este, perioada, în, care, preurile, pe, litoral, sunt, cu, până, la, mai, mici, decât, în, vârf, de, sezon, iar, pentru, muli, turiti, reprezintă, poate, singura, variantă, prin, care, pot, merge, în, vacană, la, Cele, mai, multe, hoteluri, vor, fi, deschise, începând, cu, sfâritul, lunii, mai, dar, pot, face, deja, rezervări, de, sejururi, pentru, acest, program, a, declarat, preedintele, FPTR, citat, de, AgerpresAstfel, potrivit, tarifelor, de, pe, siteurile, operatorilor, de, turism, până, pe, data, de, românii, pot, petrece, un, sejur, la, mare, cu, tarife, pornind, de, la, de, lei, pe, noapte, de, pre, ce, include, doar, cazare, fără, mic, dejun, la, un, hotel, de, stele, din, staiunea, Venus, În, staiunea, Mamaia, preurile, pornesc, de, la, leinoaptepersoană, în, camera, dublă, ofertă, valabilă, la, un, hotel, de, stele, iar, în, staiunile, din, sudul, litoralului, tarifele, încep, de, la, leinoaptepersoană, în, camera, dublă, la, un, hotel, de, stele, Pentru, cei, care, vor, pachete, all, inclusive, acestea, sunt, disponibile, la, preuri, ce, pornesc, de, la, de, leinoaptepersoană, în, camera, dublă, la, o, unitate, de, stele, din, staiunea, JupiterLe, recomandăm, turitilor, care, vor, să, profite, de, aceste, oferte, să, facă, deja, rezervări, pentru, că, locurile, sunt, limitate, i, se, epuizează, repede, Rezervările, se, pot, face, direct, la, hotel, dar, i, prin, intermediul, ageniilor, de, turism, La, fel, ca, la, ediiile, anterioare, pachetele, turistice, pot, fi, achitate, i, cu, vouchere, de, vacană, a, mai, spus, preedintele, FPTRPotrivit, FPTR, în, program, sau, înscris, până, vineri, de, unităi, de, cazare, din, toate, staiunile, de, pe, litoralul, românesc, care, pun, la, dispoziia, turitilor, cumulat, un, număr, de, aproximativ, de, locuri, de, cazare, pe, noapte, iar, până, la, începerea, programului, ateaptă, să, se, înscrie, aproximativ, de, hoteluri, care, vor, pune, la, dispoziia, turitilor, aproximativ, de, locuri, de, cazare, pe, noapteProgramul, Litoralul, pentru, Toi, se, află, la, ediia, cu, numărul, i, este, singurul, program, social, din, România, susinut, integral, de, mediul, de, afaceri, respectiv, de, patronatele, hoteliere, autohtoneFederaia, Patronatelor, din, Turismul, Românesc, este, singura, federaie, patronală, cu, reprezentativitate, legală, la, nivel, de, sector, de, activitate, turism, hoteluri, restaurante, având, în, componenă, societăi, comerciale, din, turism, care, asigură, venituri, salariale, pentru, de, angajai, gestionând, întro, pondere, covâritoare, capital, românesc]","[Turismul, Românesc, FPTR, lansează, ediie, programului, Litoralul, toi, preuri, mici, faă, vârful, sezonuluiContinuăm, program, succes, românii, ateaptă, perioada, preurile, litoral, mici, decât, vârf, sezon, muli, turiti, reprezintă, singura, variantă, merge, vacană, hoteluri, deschise, începând, sfâritul, lunii, rezervări, sejururi, program, declarat, preedintele, FPTR, citat, AgerpresAstfel, potrivit, tarifelor, siteurile, operatorilor, turism, data, românii, petrece, sejur, tarife, pornind, lei, noapte, pre, include, cazare, mic, dejun, hotel, stele, staiunea, Venus, staiunea, Mamaia, preurile, pornesc, leinoaptepersoană, camera, dublă, ofertă, valabilă, hotel, stele, staiunile, sudul, litoralului, tarifele, încep, leinoaptepersoană, camera, dublă, hotel, stele, pachete, all, inclusive, disponibile, preuri, pornesc, leinoaptepersoană, camera, dublă, unitate, stele, staiunea, JupiterLe, recomandăm, turitilor, profite, oferte, facă, rezervări, locurile, limitate, epuizează, repede, Rezervările, direct, hotel, intermediul, ageniilor, turism, ediiile, anterioare, pachetele, turistice, achitate, vouchere, vacană, spus, preedintele, FPTRPotrivit, FPTR, program, înscris, vineri, unităi, cazare, staiunile, litoralul, românesc, pun, dispoziia, turitilor, cumulat, număr, aproximativ, locuri, cazare, noapte, începerea, programului, ateaptă, înscrie, aproximativ, hoteluri, pune, dispoziia, turitilor, aproximativ, locuri, cazare, noapteProgramul, Litoralul, Toi, află, ediia, numărul, singurul, program, social, România, susinut, integral, mediul, afaceri, respectiv, patronatele, hoteliere, autohtoneFederaia, Patronatelor, Turismul, Românesc, singura, federaie, patronală, reprezentativitate, legală, nivel, sector, activitate, turism, hoteluri, restaurante, având, componenă, societăi, comerciale, turism, asigură, venituri, salariale, angajai, gestionând, întro, pondere, covâritoare, capital, românesc]","[turism, Românesc, FPTR, lansa, ediie, program, Litoral, toi, pre, mic, faa, vârf, sezonuluiContinuăm, program, succes, român, ateapta, perioadă, pre, litoral, mic, decât, vârf, sezon, mul, turiti, reprezenta, singur, variantă, merge, vacan, hotel, deschide, începe, sfârit, lună, rezervare, sejur, program, declarat, preedintă, FPTR, cita, AgerpresAstfel, potrivit, tarif, siteură, operator, turism, dată, român, petrece, sejur, Tarife, porni, leu, noapte, pre, include, cazare, mic, dejun, hotel, st, staiune, Venus, staiune, Mamaia, pre, porni, leinoaptepersoană, cameră, dublu, ofertă, valabil, hotel, st, staiune, sud, litoral, tarifele, începe, leinoaptepersoană, cameră, dublu, hotel, st, pachet, all, inclusiv, disponibil, pre, porni, leinoaptepersoană, cameră, dublu, unitate, astă, staiune, JupiterLe, recomanda, turitilor, profit, ofertă, face, rezervare, loc, limitat, epuiza, repede, rezervăre, direct, hotel, intermediu, ageni, turism, ediie, anterior, pachet, turistic, achita, vouchere, vacan, spune, preedintă, FPTRPotrivit, FPTR, program, înscrie, vineri, unităi, cazare, staiune, litoral, românesc, pune, dispoziia, turitilor, cumulat, număr, aproximativ, loc, cazar, noapte, începere, program, ateapt, înscrie, aproximativ, hotel, pune, dispoziia, turitilor, aproximativ, loc, cazar, noapteProgram, litoralul, Toi, afla, ediia, număr, singur, program, social, România, susine, integral, mediu, afacere, respectiv, patronată, hotelier, autohtoneFederaial, Patronatelor, turism, românesc, singur, federaie, patronal, reprezentativitate, legal, nivel, sector, activitate, turism, hotel, restaurant, avea, componenă, societăi, comercial, turism, asigura, venit, salarial, angajai, gestiona, întro, pondere, covâritor, capital, românesc]"
6477c36f540bc5d16fa5e2b5,Vacanțe,Bucovina și Bucureștiul au fost incluse ca destinație întrun circuit internațional de lux al cărui preț se apropie de  de dolari de persoană relatează Monitorul de SuceavaCircuitul este organizat de TCS World Travel companie specializată în turism de lux și circuite organizate cu avioane privateBucovina și Bucureștiul au fost incluse pe lista destinațiilor care vor fi vizitate întrun circuit intitulat Regate i culturi programat în perioada  iunie   iulie Bucovina a mai fost inclusă de trei ori în acest circuit înainte de pandemiePrețul pentru circuitul Regate și culturi este de  de dolari de persoană Prețul include toate facilitățile  de la călătorii cu avionul privat hoteluri transport terestru și mese până la toate activitățile zilnice ghiduri băuturi dar și bacșișurileExcursia durează  de zile și include pe lângă România destinații din Marea Britanie Muntenegru Polonia Uzbekistan Georgia Turkmenistan și Turcia Editor   MB,"[Bucovina, și, Bucureștiul, au, fost, incluse, ca, destinație, întrun, circuit, internațional, de, lux, al, cărui, preț, se, apropie, de, de, dolari, de, relatează, Monitorul, de, SuceavaCircuitul, este, organizat, de, TCS, World, Travel, companie, specializată, în, turism, de, lux, și, circuite, organizate, cu, avioane, privateBucovina, și, Bucureștiul, au, fost, incluse, pe, lista, destinațiilor, care, vor, fi, vizitate, întrun, circuit, intitulat, Regate, i, culturi, programat, în, perioada, a, mai, fost, inclusă, de, ori, în, acest, circuit, înainte, de, pandemiePrețul, pentru, circuitul, Regate, și, culturi, este, de, de, dolari, de, persoană, Prețul, include, toate, facilitățile, de, la, călătorii, cu, avionul, privat, hoteluri, transport, terestru, și, mese, până, la, toate, activitățile, zilnice, ghiduri, băuturi, dar, și, bacșișurileExcursia, durează, de, zile, și, include, pe, lângă, România, destinații, din, Marea, Britanie, Muntenegru, Polonia, Uzbekistan, Georgia, Turkmenistan, și, Turcia, Editor, MB]","[Bucovina, Bucureștiul, incluse, destinație, întrun, circuit, internațional, lux, preț, apropie, dolari, relatează, Monitorul, SuceavaCircuitul, organizat, TCS, World, Travel, companie, specializată, turism, lux, circuite, organizate, avioane, privateBucovina, Bucureștiul, incluse, lista, destinațiilor, vizitate, întrun, circuit, intitulat, Regate, culturi, programat, perioada, inclusă, circuit, pandemiePrețul, circuitul, Regate, culturi, dolari, persoană, Prețul, include, facilitățile, călătorii, avionul, privat, hoteluri, transport, terestru, mese, activitățile, zilnice, ghiduri, băuturi, bacșișurileExcursia, durează, zile, include, România, destinații, Marea, Britanie, Muntenegru, Polonia, Uzbekistan, Georgia, Turkmenistan, Turcia, Editor, MB]","[Bucovina, București, inclus, destinație, întrun, circuit, internațional, lux, preț, apropia, dolar, relata, monitor, SuceavaCircuitul, organiza, TCS, World, Travel, companie, specializat, turism, lux, circuit, organiza, avion, privateBucovina, București, include, listă, destinațiilor, vizita, întrun, circuit, intitulat, Regate, cultură, programa, perioadă, include, circuit, pandemiePreț, circuit, Regate, cultură, dolar, persoan, preț, include, facilitățile, călătore, avion, privat, hotel, transport, terestru, masă, activitate, zilnic, ghid, băutură, bacșișurileExcursia, dura, zi, include, România, destinații, mare, Britanie, Muntenegru, Polonia, Uzbekistan, Georgia, Turkmenistan, Turcia, Editor, MB]"
6477c37c540bc5d16fa5e41a,Vacanțe,Pe măsură ce oamenii încep din nou să călătorească iar prețurile mari pentru zboruri îngreunează deplasările pe distanțe lungi unele destinații fac tot ce pot pentru a atrage vizitatori care să contribuie la creșterea economică transmite CNNCel mai recent exemplu este Taiwan care plănuiește să ofere fiecărui turist  de dolari pentru ași petrece vacanța acolo Recompense în bani vor fi de asemenea oferite grupurilor de turiști pentru ai încuraja să viziteze insulaPremierul taiwanez Chen Chienjen a anunțat joi că guvernul său vrea să atragă  milioane de turiști în  și dublul acestui număr în  ținta fiind de  milioane de vizitatori până în Ca stimulent Taiwanul va oferi  de dolari de persoană pentru  de turiști De asemenea vor fi alocați  de dolari pentru fiecare grup de turiști în limita a  de grupuriMinistrul transporturilor Wang Kuotsai a declarat miercuri că subvențiile vor fi livrate digital Turiștii vor putea să le folosească pentru cheltuielile din Taiwan inclusiv pentru cazareEl a adăugat că măsurile sunt menite pentru atragerea mai multor vizitatori din economii importante printre care Japonia Coreea de Sud Asia de SudEst Hong Kong precum și Europa și SUATaiwanul a înregistrat puțin sub  de vizitatori în  potrivit statisticilor oferite de Biroul de Turism din Taiwan Vizitatorii din Vietnam Indonezia Japonia și SUA sunt printre cele mai mari grupuriAceste cifre reprezintă o fracție din cele din  când Taiwanul a atras un număr record de  milioane de turiști internaționali cu  mai mulți decât în anul anteriorInsula șia ridicat restricțiile de intrare în țară în octombrie  după una dintre cele mai lungi perioade din lume în care a avut granițele închiseÎnsă cei care vor săși programeze vacanțele acolo ar trebui să mai aștepte deoarece guvernul încă nu a anunțat când va începe schema sau cum se pot cere acești bani Editor   AC,"[Pe, măsură, ce, încep, din, nou, să, călătorească, iar, prețurile, mari, pentru, zboruri, îngreunează, deplasările, pe, distanțe, lungi, unele, destinații, fac, tot, ce, pot, pentru, a, atrage, care, să, contribuie, la, creșterea, economică, transmite, CNNCel, mai, recent, exemplu, este, Taiwan, care, plănuiește, să, ofere, fiecărui, turist, de, dolari, pentru, petrece, vacanța, acolo, Recompense, în, bani, vor, fi, de, asemenea, oferite, grupurilor, de, pentru, ai, încuraja, să, viziteze, taiwanez, a, anunțat, că, guvernul, său, vrea, să, atragă, de, în, și, dublul, acestui, număr, în, ținta, fiind, de, de, până, în, Ca, stimulent, Taiwanul, va, oferi, de, dolari, de, pentru, de, turiști, De, asemenea, vor, fi, alocați, de, dolari, pentru, fiecare, grup, de, în, limita, a, de, grupuriMinistrul, transporturilor, Wang, Kuotsai, a, declarat, că, subvențiile, vor, fi, livrate, digital, vor, putea, să, le, folosească, pentru, cheltuielile, din, Taiwan, inclusiv, pentru, cazareEl, a, adăugat, că, măsurile, sunt, menite, pentru, atragerea, mai, multor, din, economii, importante, printre, care, Japonia, Coreea, de, Sud, Asia, de, SudEst, Hong, Kong, precum, și, Europa, și, SUATaiwanul, a, înregistrat, puțin, sub, de, în, potrivit, statisticilor, oferite, de, Biroul, de, Turism, din, Taiwan, Vizitatorii, din, Vietnam, Indonezia, Japonia, și, SUA, sunt, printre, cele, mai, mari, grupuriAceste, cifre, reprezintă, o, fracție, din, cele, din, când, Taiwanul, a, atras, un, număr, record, de, de, internaționali, cu, mai, mulți, decât, în, șia, ridicat, restricțiile, de, intrare, în, țară, în, după, una, dintre, cele, mai, lungi, perioade, din, lume, în, care, a, avut, granițele, închiseÎnsă, cei, care, vor, săși, programeze, vacanțele, acolo, ar, trebui, să, mai, aștepte, deoarece, guvernul, încă, nu, a, anunțat, când, va, începe, schema, sau, cum, se, pot, cere, acești, bani, Editor, AC]","[măsură, încep, călătorească, prețurile, mari, zboruri, îngreunează, deplasările, distanțe, lungi, destinații, fac, atrage, contribuie, creșterea, economică, transmite, CNNCel, recent, exemplu, Taiwan, plănuiește, ofere, fiecărui, turist, dolari, petrece, vacanța, Recompense, bani, oferite, grupurilor, încuraja, viziteze, taiwanez, anunțat, guvernul, vrea, atragă, dublul, număr, ținta, fiind, stimulent, Taiwanul, oferi, dolari, turiști, alocați, dolari, grup, limita, grupuriMinistrul, transporturilor, Wang, Kuotsai, declarat, subvențiile, livrate, digital, putea, folosească, cheltuielile, Taiwan, inclusiv, cazareEl, adăugat, măsurile, menite, atragerea, multor, economii, importante, Japonia, Coreea, Sud, Asia, SudEst, Hong, Kong, precum, Europa, SUATaiwanul, înregistrat, puțin, potrivit, statisticilor, oferite, Biroul, Turism, Taiwan, Vizitatorii, Vietnam, Indonezia, Japonia, SUA, mari, grupuriAceste, cifre, reprezintă, fracție, Taiwanul, atras, număr, record, internaționali, decât, șia, ridicat, restricțiile, intrare, țară, lungi, perioade, lume, granițele, închiseÎnsă, săși, programeze, vacanțele, trebui, aștepte, guvernul, încă, anunțat, începe, schema, cere, acești, bani, Editor, AC]","[măsură, începe, călători, preț, mare, zbor, îngreuna, deplasările, distanță, lung, destinație, face, atrage, contribui, creștere, economic, transmite, CNNCel, recent, exemplu, Taiwan, plănuii, oferi, fiecare, turist, dolar, petrece, vacanță, Recompense, ban, oferi, grupură, încuraja, viziteză, taiwanez, anunța, guvern, vrea, atraga, dubl, număr, țint, fi, stimulent, Taiwan, oferi, dolar, turist, aloca, dolar, grup, limita, grupuriMinistr, transport, Wang, Kuotsai, declara, subvenție, livrat, digital, putea, folosi, cheltuială, Taiwan, inclusiv, cazareEl, adăuga, măsură, menit, atragere, mult, economie, important, Japonia, Coreea, sud, Asia, SudEst, Hong, Kong, precum, Europa, SUATaiwan, înregistrat, puțin, potrivit, statistică, oferit, birou, turism, Taiwan, Vizitatorii, Vietnam, Indonezia, Japonia, Statele_Unite_ale_Americii, mare, grupuriAceste, cifră, reprezenta, fracție, taiwan, atras, număr, record, internațional, decât, șia, ridicat, restricție, intrr, țară, lung, perioadă, lume, graniță, închiseÎnde, săși, programez, vacanță, trebui, aștept, guvern, încă, anunțat, începe, schemă, cere, acest, ban, Editor, AC]"
